{
  "version_schema": "1.0.0",
  "observation_id": "obs-mst-sdd-flow-implementer-por-task-r1-a1",
  "sample_id": "mst-sdd-flow-implementer-por-task-r1",
  "attempt_id": "int-mst-sdd-flow-implementer-por-task-r1-a1",
  "attempt_ordinal": 1,
  "preregistro_sha256": "5555555555555555555555555555555555555555555555555555555555555555",
  "procedencia": {
    "run_id": "run-g-a1",
    "bundle_sha256": "ffffffffffffffffffffffffffffffffffffffffffffffffffffffffffffffff"
  },
  "punto_de_despacho": "sdd-flow-implementer-por-task",
  "skill": "sdd-flow",
  "familia_de_rol": "bounded-implementer",
  "transporte": "subagent",
  "estrato": "automatizable",
  "estado": {
    "ciclo_operativo": "completado",
    "validez_del_reporte": "malformado",
    "resultado_semantico": "no_evaluable"
  },
  "metricas": [
    {
      "metrica_id": "latencia-hasta-resultado-utilizable",
      "categoria": "latencia",
      "estado_de_medicion": "medida",
      "valor": 100000.0,
      "unidad": "milisegundos"
    },
    {
      "metrica_id": "tasa-de-degradacion",
      "categoria": "degradacion",
      "estado_de_medicion": "medida",
      "valor": 0.0,
      "unidad": "proporcion",
      "numerador": 0.0,
      "denominador": 1.0
    },
    {
      "metrica_id": "conteo-de-degradaciones",
      "categoria": "degradacion",
      "estado_de_medicion": "medida",
      "valor": 0.0,
      "unidad": "conteo"
    },
    {
      "metrica_id": "salidas-invalidas",
      "categoria": "salidas_invalidas",
      "estado_de_medicion": "medida",
      "valor": 1.0,
      "unidad": "conteo"
    },
    {
      "metrica_id": "tasa-de-salidas-invalidas",
      "categoria": "salidas_invalidas",
      "estado_de_medicion": "medida",
      "valor": 1.0,
      "unidad": "proporcion",
      "numerador": 1.0,
      "denominador": 1.0
    },
    {
      "metrica_id": "hallazgos-emitidos",
      "categoria": "hallazgos",
      "estado_de_medicion": "medida",
      "valor": 1.0,
      "unidad": "conteo"
    },
    {
      "metrica_id": "limpieza-completa",
      "categoria": "limpieza",
      "estado_de_medicion": "medida",
      "valor": 1.0,
      "unidad": "booleano"
    }
  ],
  "trabajos_delegados": [
    {
      "trabajo_delegado_id": "trb-a1",
      "estado_terminal": {
        "estado": "comprobado",
        "evento_terminal_id": "evt-a1-terminal"
      },
      "metricas": [
        {
          "metrica_id": "latencia-hasta-estado-terminal",
          "categoria": "latencia",
          "estado_de_medicion": "medida",
          "valor": 90000.0,
          "unidad": "milisegundos"
        }
      ]
    }
  ]
}
