{
  "version_schema": "1.0.0",
  "observation_id": "obs-mst-co-explore-fan-out-dual-r1-a1",
  "sample_id": "mst-co-explore-fan-out-dual-r1",
  "attempt_id": "int-mst-co-explore-fan-out-dual-r1-a1",
  "attempt_ordinal": 1,
  "preregistro_sha256": "b93f3abeedf5dacec10b5e376fa2d7c11db3b88b60db4bd35bcbb65d39db0105",
  "procedencia": {
    "run_id": "run-int-mst-co-explore-fan-out-dual-r1-a1",
    "bundle_sha256": "b1879a0f57580b117791e062741842c40fcf070439d6c1bbeb00dae82dc8bf67"
  },
  "punto_de_despacho": "co-explore-fan-out-dual",
  "skill": "co-explore",
  "familia_de_rol": "explorer",
  "transporte": "cli-exec",
  "estrato": "automatizable",
  "estado": {
    "ciclo_operativo": "completado",
    "validez_del_reporte": "ausente",
    "resultado_semantico": "no_evaluable"
  },
  "metricas": [
    {
      "metrica_id": "latencia-hasta-resultado-utilizable",
      "categoria": "latencia",
      "estado_de_medicion": "medida",
      "valor": 0.009375,
      "unidad": "milisegundos"
    },
    {
      "metrica_id": "tasa-de-degradacion",
      "categoria": "degradacion",
      "estado_de_medicion": "medida",
      "valor": 0.0,
      "unidad": "proporcion",
      "numerador": 0.0,
      "denominador": 1.0
    },
    {
      "metrica_id": "conteo-de-degradaciones",
      "categoria": "degradacion",
      "estado_de_medicion": "medida",
      "valor": 0.0,
      "unidad": "conteo"
    },
    {
      "metrica_id": "salidas-invalidas",
      "categoria": "salidas_invalidas",
      "estado_de_medicion": "medida",
      "valor": 1.0,
      "unidad": "conteo"
    },
    {
      "metrica_id": "tasa-de-salidas-invalidas",
      "categoria": "salidas_invalidas",
      "estado_de_medicion": "medida",
      "valor": 1.0,
      "unidad": "proporcion",
      "numerador": 1.0,
      "denominador": 1.0
    },
    {
      "metrica_id": "hallazgos-emitidos",
      "categoria": "hallazgos",
      "estado_de_medicion": "medida",
      "valor": 0.0,
      "unidad": "conteo"
    },
    {
      "metrica_id": "limpieza-completa",
      "categoria": "limpieza",
      "estado_de_medicion": "medida",
      "valor": 0.0,
      "unidad": "booleano"
    }
  ],
  "trabajos_delegados": [
    {
      "trabajo_delegado_id": "trb-run-int-mst-co-explore-fan-out-dual-r1-a1",
      "estado_terminal": {
        "estado": "comprobado",
        "evento_terminal_id": "evt-run-int-mst-co-explore-fan-out-dual-r1-a1-4"
      },
      "metricas": [
        {
          "metrica_id": "latencia-hasta-estado-terminal",
          "categoria": "latencia",
          "estado_de_medicion": "medida",
          "valor": 0.005333,
          "unidad": "milisegundos"
        }
      ]
    }
  ]
}
