{
  "version_schema": "1.0.0",
  "observation_id": "obs-mst-cross-implement-implementador-inicial-r1-a1",
  "sample_id": "mst-cross-implement-implementador-inicial-r1",
  "attempt_id": "int-mst-cross-implement-implementador-inicial-r1-a1",
  "attempt_ordinal": 1,
  "preregistro_sha256": "5555555555555555555555555555555555555555555555555555555555555555",
  "procedencia": {
    "run_id": "run-g-c1",
    "bundle_sha256": "f4dd7b5cd5fc7ef7ad2b4c8cb3c15e15b32f874f7ff62cd1073b71900cf98f61"
  },
  "punto_de_despacho": "cross-implement-implementador-inicial",
  "skill": "cross-implement",
  "familia_de_rol": "bounded-implementer",
  "transporte": "cli-exec",
  "estrato": "automatizable",
  "estado": {
    "ciclo_operativo": "degradado",
    "validez_del_reporte": "valido",
    "resultado_semantico": "incorrecto"
  },
  "metricas": [
    {
      "metrica_id": "latencia-hasta-resultado-utilizable",
      "categoria": "latencia",
      "estado_de_medicion": "medida",
      "valor": 30000.0,
      "unidad": "milisegundos"
    },
    {
      "metrica_id": "tasa-de-degradacion",
      "categoria": "degradacion",
      "estado_de_medicion": "medida",
      "valor": 1.0,
      "unidad": "proporcion",
      "numerador": 1.0,
      "denominador": 1.0
    },
    {
      "metrica_id": "conteo-de-degradaciones",
      "categoria": "degradacion",
      "estado_de_medicion": "medida",
      "valor": 1.0,
      "unidad": "conteo"
    },
    {
      "metrica_id": "salidas-invalidas",
      "categoria": "salidas_invalidas",
      "estado_de_medicion": "medida",
      "valor": 0.0,
      "unidad": "conteo"
    },
    {
      "metrica_id": "tasa-de-salidas-invalidas",
      "categoria": "salidas_invalidas",
      "estado_de_medicion": "medida",
      "valor": 0.0,
      "unidad": "proporcion",
      "numerador": 0.0,
      "denominador": 1.0
    },
    {
      "metrica_id": "hallazgos-emitidos",
      "categoria": "hallazgos",
      "estado_de_medicion": "medida",
      "valor": 0.0,
      "unidad": "conteo"
    },
    {
      "metrica_id": "limpieza-completa",
      "categoria": "limpieza",
      "estado_de_medicion": "medida",
      "valor": 0.0,
      "unidad": "booleano"
    }
  ],
  "trabajos_delegados": [
    {
      "trabajo_delegado_id": "trb-c1",
      "estado_terminal": {
        "estado": "comprobado",
        "evento_terminal_id": "evt-c1-terminal"
      },
      "metricas": [
        {
          "metrica_id": "latencia-hasta-estado-terminal",
          "categoria": "latencia",
          "estado_de_medicion": "medida",
          "valor": 20000.0,
          "unidad": "milisegundos"
        }
      ]
    }
  ]
}
