{
  "version_schema": "1.0.0",
  "observation_id": "obs-mst-bitbucket-code-review-panel-de-revisores-r1-a1",
  "sample_id": "mst-bitbucket-code-review-panel-de-revisores-r1",
  "attempt_id": "int-mst-bitbucket-code-review-panel-de-revisores-r1-a1",
  "attempt_ordinal": 1,
  "preregistro_sha256": "b93f3abeedf5dacec10b5e376fa2d7c11db3b88b60db4bd35bcbb65d39db0105",
  "procedencia": {
    "run_id": "run-int-mst-bitbucket-code-review-panel-de-revisores-r1-a1",
    "bundle_sha256": "42c22bd56c2993f6ed8f8cbac7101742359c6dd4ba059c29ed57c983bfbd2d13"
  },
  "punto_de_despacho": "bitbucket-code-review-panel-de-revisores",
  "skill": "bitbucket-code-review",
  "familia_de_rol": "diff-reviewer",
  "transporte": "cli-exec",
  "estrato": "automatizable",
  "estado": {
    "ciclo_operativo": "completado",
    "validez_del_reporte": "ausente",
    "resultado_semantico": "no_evaluable"
  },
  "metricas": [
    {
      "metrica_id": "latencia-hasta-resultado-utilizable",
      "categoria": "latencia",
      "estado_de_medicion": "medida",
      "valor": 0.019459,
      "unidad": "milisegundos"
    },
    {
      "metrica_id": "tasa-de-degradacion",
      "categoria": "degradacion",
      "estado_de_medicion": "medida",
      "valor": 0.0,
      "unidad": "proporcion",
      "numerador": 0.0,
      "denominador": 1.0
    },
    {
      "metrica_id": "conteo-de-degradaciones",
      "categoria": "degradacion",
      "estado_de_medicion": "medida",
      "valor": 0.0,
      "unidad": "conteo"
    },
    {
      "metrica_id": "salidas-invalidas",
      "categoria": "salidas_invalidas",
      "estado_de_medicion": "medida",
      "valor": 1.0,
      "unidad": "conteo"
    },
    {
      "metrica_id": "tasa-de-salidas-invalidas",
      "categoria": "salidas_invalidas",
      "estado_de_medicion": "medida",
      "valor": 1.0,
      "unidad": "proporcion",
      "numerador": 1.0,
      "denominador": 1.0
    },
    {
      "metrica_id": "hallazgos-emitidos",
      "categoria": "hallazgos",
      "estado_de_medicion": "medida",
      "valor": 0.0,
      "unidad": "conteo"
    },
    {
      "metrica_id": "limpieza-completa",
      "categoria": "limpieza",
      "estado_de_medicion": "medida",
      "valor": 1.0,
      "unidad": "booleano"
    }
  ],
  "trabajos_delegados": [
    {
      "trabajo_delegado_id": "trb-run-int-mst-bitbucket-code-review-panel-de-revisores-r1-a1",
      "estado_terminal": {
        "estado": "comprobado",
        "evento_terminal_id": "evt-run-int-mst-bitbucket-code-review-panel-de-revisores-r1-a1-4"
      },
      "metricas": [
        {
          "metrica_id": "latencia-hasta-estado-terminal",
          "categoria": "latencia",
          "estado_de_medicion": "medida",
          "valor": 0.010084,
          "unidad": "milisegundos"
        }
      ]
    }
  ]
}
